{"schema_version":1,"task_id":"7f1c2a9e-3b4d-4e5f-8a6b-1c2d3e4f5a6b","repository":{"commit":"0123456789abcdef0123456789abcdef01234567","branch":"main"},"artifacts":[{"path":"src/payments/payment.service.ts","symbol":"PaymentService.create","kind":"code","reason":"target symbol","content_hash":"sha256:ab12","retrieval_score":0.87},{"path":"docs/adr/idempotency.md","symbol":null,"kind":"documentation","reason":"ADR constraint","content_hash":"sha256:cd34"}],"constraints":["Do not add dependencies"],"acceptance_tests":["pnpm test PaymentService"]}
